{
  "schemaVersion": "1.0",
  "projectId": "task-board-demo",
  "sourceDocuments": [
    {
      "id": "DOC-001",
      "path": "../docs/PRD.md",
      "title": "虚构任务板 PRD",
      "sha256": "f508844d863b89c44439a7ecc20a0ed227ee3ed60752f75fa9b9dc9891cb6211"
    }
  ],
  "requirements": [
    {
      "id": "REQ-001",
      "title": "任务查找",
      "type": "page",
      "statement": "任务列表展示任务标题、负责人代号、截止日期和进度，支持关键词搜索与待办、进行中、已完成筛选。",
      "sourceRefs": [
        {
          "documentId": "DOC-001",
          "startLine": 5,
          "endLine": 5,
          "quote": "任务列表展示任务标题、负责人代号、截止日期和进度，支持关键词搜索与待办、进行中、已完成筛选。"
        }
      ],
      "classification": "explicit",
      "confidence": 1,
      "confirmationStatus": "confirmed",
      "priority": "P0",
      "prototypeCritical": true
    },
    {
      "id": "REQ-002",
      "title": "任务详情",
      "type": "interaction",
      "statement": "点击任务进入详情，详情展示任务说明、负责人代号、截止日期和进度；支持标记完成并返回列表。",
      "sourceRefs": [
        {
          "documentId": "DOC-001",
          "startLine": 6,
          "endLine": 6,
          "quote": "点击任务进入详情，详情展示任务说明、负责人代号、截止日期和进度；支持标记完成并返回列表。"
        }
      ],
      "classification": "explicit",
      "confidence": 1,
      "confirmationStatus": "confirmed",
      "priority": "P0",
      "prototypeCritical": true
    },
    {
      "id": "REQ-003",
      "title": "页面状态",
      "type": "state",
      "statement": "列表和详情支持正常、加载、空、失败状态，失败时提供重试入口；本案例不模拟权限和过期状态。",
      "sourceRefs": [
        {
          "documentId": "DOC-001",
          "startLine": 7,
          "endLine": 7,
          "quote": "列表和详情支持正常、加载、空、失败状态，失败时提供重试入口；本案例不模拟权限和过期状态。"
        }
      ],
      "classification": "explicit",
      "confidence": 1,
      "confirmationStatus": "confirmed",
      "priority": "P0",
      "prototypeCritical": true
    },
    {
      "id": "REQ-004",
      "title": "会话数据",
      "type": "rule",
      "statement": "数据来自本地虚构任务集合；完成状态、搜索词和筛选条件在当前浏览器会话中保留，刷新后可恢复；没有登录、外部接口或真实消息发送。",
      "sourceRefs": [
        {
          "documentId": "DOC-001",
          "startLine": 8,
          "endLine": 8,
          "quote": "数据来自本地虚构任务集合；完成状态、搜索词和筛选条件在当前浏览器会话中保留，刷新后可恢复；没有登录、外部接口或真实消息发送。"
        }
      ],
      "classification": "explicit",
      "confidence": 1,
      "confirmationStatus": "confirmed",
      "priority": "P0",
      "prototypeCritical": true
    }
  ],
  "openQuestions": []
}
